{
  "$schema": "../../schema/showcase.config.schema.json",
  "name": "motion",
  "motionOnly": true,
  "length": 45,
  "formats": [
    "landscape",
    "vertical"
  ],
  "audience": "someone who makes product demo videos by hand",
  "promise": "A demo video can be written, not recorded",
  "cta": {
    "text": "Write your first video.",
    "sub": "showcase init --config"
  },
  "motion": {
    "blur": true
  },
  "sound": {
    "effects": "auto",
    "mood": "calm soft light"
  }
}
